{
  "v": 2,
  "id": "01JB2Z8Y3K4M5N6P7Q8R9S0TVW",
  "type": "command.result",
  "ts": 1761274800000,
  "replyTo": "01JB2Z8Y3K4M5N6P7Q8R9S0TVX",
  "payload": {
    "status": "ok",
    "data": {
      "output": [
        "There are 2 of a max of 20 players online: Steve, Alex"
      ],
      "truncated": false,
      "executionMs": 3
    }
  }
}
