{
  "v": 2,
  "id": "01JB2Z8Y3K4M5N6P7Q8R9S0TVW",
  "type": "command.result",
  "ts": 1761274800000,
  "replyTo": "01JB2Z8Y3K4M5N6P7Q8R9S0TVX",
  "payload": {
    "status": "error",
    "code": "command_blocked",
    "message": "command is on the blocklist",
    "details": {
      "matched": "op"
    }
  }
}
